objectid,filename,title,creator,date,display_date,description,subject,location,Collection,format,physicaldescription,rights,latitude,longitude
image3,image3.jpg,"January, from the Les Très Riches Heures du Duc de Berry",Limbourg Brothers (fl. 1385-1416),1385-1416,1385-1416,"The Duke of Berry, seated lower right, with his back to the fire, is dressed in blue and wearing a fur cap. He invites his people and relatives to introduce themselves to him. Behind him is the inscription “Approche Approche”. Several of the duke's familiars approach him while servants are busy: the cupbearers are serving drinks, two sharp squires in the center are seen from behind; at the end of the table officiates a baker. Above the fireplace are the duke's coat of arms, ""azure strewn with fleur-de-lis d'or, with a engrailed border gules"", with small bears and wounded swans. Several pets are represented: small dogs on the table, greyhound on the ground. The tapestry
at the back of the room seems to represent episodes from the Trojan War",,"Chantilly, France",Musée Condé,image/jpeg,parchment,"""January, from the Les Très Riches Heures du Duc de Berry"" by: R-G Ojéda/RMN (https://commons.wikimedia.org/wiki/File:Les_Tr%C3%A8s_Riches_Heures_du_duc_de_Berry_Janvier.jpg), PD-US",49.19551862,2.494349077
image4,image4.jpg,"February, from the Les Très Riches Heures du Duc de Berry",Limbourg Brothers (fl. 1385-1416),1385-1416,1385-1416,"February: An enclosure surrounds a farm comprising a sheep pen and, on the right, four beehives and a dovecote. Inside the house, a woman and a couple of young man and young woman warm themselves in front of the fire. Outside, a man chops down a tree with an axe, bundles of sticks at his feet, while another gets ready to go inside while blowing on his hands to warm them. Further away, a third drives a donkey, loaded with wood, towards the neighbouring village.",,"Chantilly, France",Musée Condé,image/jpeg,parchment,"""February, from the Les Très Riches Heures du Duc de Berry"" by: R-G Ojéda/RMN (https://commons.wikimedia.org/wiki/File:Les_Tr%C3%A8s_Riches_Heures_du_duc_de_Berry_f%C3%A9vrier.jpg), PD-US",49.19551862,2.494349077
image5,image5.jpg,King David,"Sluter, Claus (1340-1406)",1340-1406,1340s to 1405 or 1406,"Description from wikipedia: Life-sized figures representing Old Testament prophets and kings (Moses, David, Daniel, Jeremiah, Zachariah, and Isaiah) stand around the base, holding phylacteries and books inscribed with verses from their respective texts, which were interpreted in the Middle Ages as typological prefigurations of the sacrifice of Christ. The work's physical structure, in which the Old Testament figures support those of the New Dispensation, literalizes the typological iconography. The pedestal surmounts a hexagonal fountain. The entire monument is executed in limestone quarried from Tonnerre and Asnières. Traces of original polychromy by Jean Malouel",,"Dijon, France",n/a,image/jpeg,sculpture,"""King David"" by Ponyterr (https://upload.wikimedia.org/wikipedia/commons/2/20/Claus_Sluter._Moses_Well._Puits_de_Mo%C3%AFse._%D0%9A%D0%BE%D0%BB%D0%BE%D0%B4%D0%B5%D1%86_%D0%9C%D0%BE%D0%B8%D1%81%D0%B5%D1%8F_%D0%B8%D0%BB%D0%B8_%D0%9A%D0%BE%D0%BB%D0%BE%D0%B4%D0%B5%D1%86_%D0%9F%D1%80%D0%BE%D1%80%D0%BE%D0%BA%D0%BE%D0%B2._%D0%9A%D0%BB%D0%B0%D1%83%D1%81_%D0%A1%D0%BB%D1%8E%D1%82%D0%B5%D1%80._1395-1405_%284%29.JPG), PD-US",47.32185176,5.017511756
image6,image6.jpg,Madonna of Chancellor,"van Eyck, Jan (1390-1441)",1390-1441,1390-1441,"Architectural setting – basilica, triple arcade allusive to the Trinity, historiated capitals – very symbolic, and imaginary and ideal landscape as much as virtuosoly realistic (some have seen there a little naively Lyon, Ghent, Liège, Stein-am-Rhein, Maastricht, Autun, Geneva, Utrecht, etc.), illustrating the greatness of the creator God. The gesture of blessing the Child was not originally planned (absent from the underlying drawing). Chancellor Rolin (in ceremonial clothes), still recognized as such in the painting in the 18th century. and reidentified in the middle of the 19th century. (1844, 1857 and 1860, cf. Comblen-Sonkes [1995], p. 21), humbly adore Jesus child, naked, and yet divine and sovereign (the Child holds like a king a globe of the world surmounted by a cross ). The biblical inscriptions (Ecclesiasticus and Psalms) on the Virgin's mantle exalt the fundamental role of Mary, represented as a queen (she is crowned by an angel). (Description source: https://collections.louvre.fr/en/ark:/53355/cl010061856) 


",,"Paris, France",Musée du Louvre,image/jpeg,"oil on wood; height: 0,66 m ; length: 0,62 m","""Madonna of Chancellor"" by Musée du Louvres, (https://commons.wikimedia.org/wiki/File:La_Vierge_du_chancelier_Rolin_-_Jan_van_Eyck_-_Mus%C3%A9e_du_Louvre_Peintures_INV_1271.jpg), PD-US.",48.86265165,2.338353214
image7,image7.jpg,Portrait of Giovanni(?) Arnolfini and his Wife,"van Eyck, Jan (1390-1441)",1434,1434,"This must be one of the most famous and intriguing paintings in the world. A richly dressed man and woman stand in a private room.They are probably Giovanni di Nicolao di Arnolfini, an Italian merchant working in Bruges, and his wife.
Although the room is totally plausible – as if Jan van Eyck had simply removed a wall – close examination reveals inconsistencies: there’s not enough space for the chandelier, and no sign of a fireplace. Moreover, every object has been carefully chosen to proclaim the couple’s wealth and social status without risking criticism for aping the aristocracy.
The man’s hand is raised, apparently in greeting. On the back wall, a large convex mirror reflects two men coming into the room, one of whom also raises his arm. Immediately above it is Van Eyck’s signature. Could the man in mirror be van Eyck himself, with his servant, coming on a visit?",,"Washington D.C., USA",National Gallery of Art,image/jpeg,Oil on oak Dimensions; 82.2 × 60 cm,"""Portrait of Giovanni(?) Arnolfini and his Wife"", Photo by Gennadii Saus i Segura (https://commons.wikimedia.org/wiki/File:The_Arnolfini_portrait_(1434).jpg), PD-US",38.89154008,-77.0193642
image8,image8.jpg,Merode altarpiece (Triptych of the Annunciation),"Campin, Robert (c. 1375-1444)",1425-28,c. 1425-28,"Having just entered the room, the angel Gabriel is about to tell the Virgin Mary that she will be the mother of Jesus. The golden rays pouring in through the left oculus carry a miniature figure with a cross. On the right wing, Joseph, who is betrothed to the Virgin, works in his carpenter’s shop, drilling holes in a board. The mousetraps on the bench and in the shop window opening onto the street are thought to allude to references in the writings of Saint Augustine identifying the cross as the devil’s mousetrap. On the left wing, the kneeling donor appears to witness the central scene through the open door. His wife kneels behind him, and a town messenger stands at the garden gate. The owners would have purchased the triptych to use in private prayer. An image of Christ’s conception in an interior not unlike the one in which they lived also may have reinforced their hope for their own children.
One of the most celebrated early Netherlandish paintings—particularly for its detailed observation, rich imagery, and superb condition—this triptych belongs to a group of paintings associated with the Tournai workshop of Robert Campin (ca. 1375–1444), sometimes called the Master of Flémalle. Documents indicate that he hired at least two assistants, the young Rogier van der Weyden (ca. 1400–1464) and Jacques Daret (ca. 1404–1468). Stylistic and technical evidence suggests that the altarpiece was executed in phases. The Annunciation, which follows a slightly earlier workshop composition, probably was not commissioned. Shortly thereafter, the male donor ordered the wings, which appear to have been painted by two artists. At a later point, in the 1430s, presumably following the donor’s marriage, the portraits of his wife and of the messenger were added. The windows of the central panel, originally covered with gold leaf, were painted with a blue sky, and the armorial shields were added afterward.",,"New York City, USA",Metropolitan Museum of Art,image/jpeg,Oil on oak; Dimensions: Overall: 25 3/8 x 46 3/8 in. (64.5 x 117.8 cm),"""Annunciation Triptych (Merode Altarpiece)"" by Metropolitan Museum of Art, the Cloisters Collection, 1956 (https://www.metmuseum.org/art/collection/search/470304), PD-US",40.77965593,-73.96264319
image9,image9.jpg,Deposition (aka Descent from the Cross),"van der Weyden, Rogier (1399-1464)",1435,c. 1435,"The Descent from the Cross was painted for the Chapel of Our Lady Outside the Walls at Leuven, which was founded in the fourteenth century by the Great Crossbowmen`s Guild, sold in 1798 and demolished soon afterwards.The two small crossbows that hang from the tracery in the corners of the panel indicate that it was commissioned by that guild.The earliest datable copy, the Edelheere Triptych of 1443 (Leuven, Saint Peter`s Church), shows that the Descent was completed before that date. Acquired from the Chapel by Mary of Hungary (1505-1558), it was displayed in 1549 in the chapel of her castle at Binche. Mary`s nephew Philip II of Spain placed it before 1564 in the chapel of his palace at El Pardo outside Madrid.Taken to the Escorial in 1566, it remained there until 1939, when it was transferred to the Prado.The shape of the Descent is that commonly used in Brabant for the centrepieces of large winged altarpieces.The projection at the top could have had its own small wings, while the rest could have been protected by rectangular shutters, possibly without imagery. Philip II commissioned new wing panels in 1566, which were painted by Juan Fernández Navarrete, El Mudo (1526-1579).The original wing-panels and El Mudo`s have been lost without trace. Cleaned in 1992-93, the painting is exceptionally well preserved.",,"Madrid, Spain",Museo del Prado,image/jpeg,oil on oak wood; height: 220 cm(86.6 in); width: 262 cm (103.1 in),"""Deposition (aka Descent from the Cross)"" by Museo del Prado (https://www.museodelprado.es/en/the-collection/art-work/the-descent-from-the-cross/856d822a-dd22-4425-bebd-920a1d416aa7), PD-US",40.41401867,-3.691665762
image10,image10.jpg,Portinari altarpiece,"van der Goes, Hugo (1430/40-1482)",1473-1478,c. 1473-1478,"In the background, van der Goes painted scenes related to the main subject: on the left panel, Joseph and Mary on the road to Bethlehem; on the central panel (to the right), the shepherds visited by the angel; on the right panel, the Three Magi on the road to Bethlehem. Hugo van der Goes used continuous narrative to show the same characters repeated in one painting. In the central panel, he sets the characters up in the background first. Here, the shepherds are seen with an angel over their heads.This scene is the Annunciation of the Shepherds where the angel comes to tell the shepherds of the news of Christ's birth. In the foreground of the central panel, the shepherds are seen now adoring Christ across from the Virgin Mary. Description source: https://www.uffizi.it/en/online-exhibitions/portinari-triptych#1",,"Florence, Italy",Gallerie degli Uffizi,image/jpeg,Oil on wood; 583 × 304 cm (19.1 × 9.9 ft),"""Portinari altarpiece"" by the Yorck Project (2002) (https://commons.wikimedia.org/wiki/File:Hugo_van_der_Goes_004.jpg), PD-US",43.76798702,11.25569704
image11,image11.jpg,Marten Nieuwenhove diptych,Hans Memling (1433-1494),1487,1487,"The painting is an early example of an Early Netherlandish devotional diptych, which still preserves the original frame and hinges. A new invention was showing the scene in a continuous room, instead of against a monochrome background.
The window at the upper left originally was clear glass, showing a landscape. The composition was changed at a later stage to show the coat of arms of Van Nieuwenhove here instead. It was more common to have this on the outer panels than this prominently. It is surrounded by four images of a hand sowing seeds, a pun on the name of the donor which means ""from the new garden"". The same coat of arms can also be seen on the clasp of the book in front of Van Nieuwenhove.
The mirror behind Mary shows the scene in reverse, making it even more explicit that the two panels are placed in the same room and time, even though the actual configuration seen in the mirror does not match the scene in the main painting. Memling only included the mirror in a later stage of the composition. This unity of space was also emphasized by small details like the carpet to the left of Mary, which reappears beneath the hands of van Nieuwenhove. The work was probably intended to be displayed with the two panels at an angle, but it is uncertain how exactly they should be placed. One possibility is that it was intended to be hung from a wall or column, with the Virign panel fixed and the van Nieuwenhove panel loose.
The inscription at the bottom of the two panels reads ""HOC OPUS FIERI FECIT MARTINUS DE NEWENHOVEN ANNO DM 1487 - ANO VERO ETATIS SUE 23"" meaning ""Maarten van Nieuwenhove had this work made in 1487"" (left panel) and ""At the age of 23"" (right panel).
The glass panels in the windows depict Saint Christopher and Saint George (above the Virgin and Child) and Saint Martin of Tours (as his namesake saint) above Maarten van Nieuwenhove. Through the open window, one can see the Minnewater, also (mistakenly) known as the ""Lake of Love"" ('minne' being the Medieval term for 'love' in Dutch), a romantic corner of Bruges.",,"Florence, Italy",Gallerie degli Uffizi,image/jpeg,oil on oak wood; height: 52 cm (20.4 in); width: 41.5 cm (16.3 in) (each),"""Marten Nieuwenhove diptych"" by the Web Gallery of Art (https://www.wga.hu/frames-e.html?/html/m/memling/3mature6/33nieuw.html), PD-US",43.76798702,11.25569704
image12,image12.jpg,Garden of Earthly Delights,"Bosch, Hieronymous (1450-1516)",1510-1515,c. 1510-1515,"The Garden of Earthly Delights is Bosch’s most complex and enigmatic creation. For Falkenburg the overall theme of The Garden of Earthly Delights is the fate of humanity, as in The Haywain (P02052), although Bosch visualizes this concept very differently and in a much more explicit manner in the centre panel of that triptych than in The Garden of Earthly Delights. In order to analyse the work’s meaning the content of each panel must be identified. Read more at https://www.museodelprado.es/en/the-collection/art-work/the- garden-of-earthly-delights-triptych/02388242-6d6a-4e9e-a992-e1311eab3609",,"Madrid, Spain",Museo del Prado,image/jpeg,Oil on Oak; 220.0 x 390.0 cm,"""Garden of Earthly Delights"" by the Bosch Project (http://boschproject.org/#/artworks/The_Garden_of_Earthly_Delights), PD-US",40.41401867,-3.691665762
image15,image15.jpg,St Anthony Triptych,"Bosch, Hieronymous (1450-1516)",1505-1510,1505-1510,"The work tells symbolically the story of the mental and spiritual torments endured by St. Anthony Abbot throughout his life.The sources for the subjects were Athanasius of Alexandria's Life of St. Anthony,[1] which had been popularized in Flanders by Pieter van Os, and Jacopo da Varazze's Golden Legend.",,"Lisbon, Portugal",Museu Nacional de Arte Antiga,image/jpeg,oil on oak wood; Central panel: 131.5 × 119 cm (51.7 × 46.8 in); Side panels: 131.5 × 53 cm (51.7 × 20.8 in),"""St. Anthony Triptych"" by Paul Hermans (19 October 2009), (http://www.museudearteantiga.pt/collections/european-painting/temptations-of-st-anthony), PD",38.70508398,-9.160783021
image16,image16.jpg,Altar of the Holy Blood,"Riemenschneider, Tilman (1460-1531)",1499-1505,1499-1505,,,"Rothenburg ob der Tauber, Germany",n/a,image/jpeg,limewood and amber glaze,"""Altar of the Holy Blood"" by Holger Uwe Schmitt (https://commons.wikimedia.org/wiki/File:Tilmann_Riemenschneider_der_Heilig-Blut-Altar_in_Rothenburg_ob_der_Tauber_01.jpg),  Creative Commons Attribution-Share Alike 4.0 International",49.38089844,10.18001824
image17,image17.jpg,Isenheim Altarpiece (front),"Grünewald, Matthias (1470-1528)",1515,1515,"The Isenheim Altarpiece is an altarpiece sculpted and painted by, respectively, the Germans Nikolaus of Haguenau and Matthias Grünewald in 1512–1516.[1] It is on display at the Unterlinden Museum at Colmar, Alsace, in France. It is Grünewald's largest work and is regarded as his masterpiece. It was painted for the Monastery of St. Anthony in Issenheim near Colmar, which specialized in hospital work. The Antonine monks of the monastery were noted for their care of plague sufferers as well as for their treatment of skin diseases, such as ergotism.The image of the crucified Christ is pitted with plague-type sores, showing patients that Jesus understood and shared their afflictions.The veracity of the work's depictions of medical conditions was unusual in the history of European art.",,"Colmar, France",Unterlinden Museum,image/jpeg,oil paint on panel; height: 269 cm (105.9 in) ; width: 307 cm (10 ft) ,"""Isenheim Altarpiece (first view)"" by Archaeodontosaurus (https://commons.wikimedia.org/wiki/File:Grunewald_Isenheim1.jpg)",48.08280816,7.365947319
image18,image18.jpg,Isenheim Altarpiece (back),"Grünewald, Matthias (1470-1528)",1515,1515,"The Isenheim Altarpiece is an altarpiece sculpted and painted by, respectively, the Germans Nikolaus of Haguenau and Matthias Grünewald in 1512–1516.[1] It is on display at the Unterlinden Museum at Colmar, Alsace, in France. It is Grünewald's largest work and is regarded as his masterpiece. It was painted for the Monastery of St. Anthony in Issenheim near Colmar, which specialized in hospital work. The Antonine monks of the monastery were noted for their care of plague sufferers as well as for their treatment of skin diseases, such as ergotism.The image of the crucified Christ is pitted with plague-type sores, showing patients that Jesus understood and shared their afflictions.The veracity of the work's depictions of medical conditions was unusual in the history of European art.",,"Colmar, France",Unterlinden Museum,image/jpeg,oil paint on panel; height: 269 cm (105.9 in) ; width: 307 cm (10 ft) ,"""Isenheim Altarpiece (second view)"" by Archaeodontosaurus (https://commons.wikimedia.org/wiki/File:Grunewald_Isenheim2.jpg)",48.08280816,7.365947319
image19,image19.jpg,Virgin and Child in glory w/ Sts Catherine and Barbara,Anonymous ,1450,c. 1450,"The Virgin and Child in glory, with St Catherine and St Barbara; the Virgin, holding the Child with her left arm, stands on the crescent within a mandorla, which is held at the top by two angels, to the left sits St Catherine of Alexandria, to the right St Barbara",,,n/a,image/jpeg,Woodcut with hand-colouring on paper; Height: 79 millimetres Width:Width: 78 millimetres,"""The Virgin and Child in glory, with St Catherine and St Barbara"" by the British Museum (https://www.britishmuseum.org/collection/object/P_1856-0209-83), Creative Commons Attribution-NonCommercial-ShareAlike 4.0 International (CC BY-NC-SA 4.0)",,
image20,image20.png,St. Dorothy,Anonymous Bavarian artist,1410-25,1410-25,"Dorothy appears often in woodcuts, bur rarely as the victim of torture, although she was impaled on a stake, her breasts were torched, and finally she was decapitated by order of Governor Fabricius in 304. It was herencoun- terwith the Christ Child that endeared her most widely. On the way to her final trial and decapitation, she was accosted by one of the trial clerks, Theophilus, who mocked her unshakable love of Jesus and requested that she send him roses and apples when she reached paradise. A moment later Dotothy was met by a little boy with golden curls and a white dress who supplied her with a basket of fruit and flowers. (Origins of European Printmaking: Fifteenth-century Woodcuts and Their Public, 128)",,"Munich, Germany",n/a,image/jpeg,"woodcut, hand-colored; 270mm x 197mm","Anonymous, Saint Dorothy and the Christ Child. 1410-1420. In Peter W. Parshall, et al., Origins of European Printmaking: Fifteenth-century Woodcuts and Their Public, 129. Washington D.C.: National Gallery of Art, 2005.",48.13541752,11.57994325
image21,image21.jpg,Man of Sorrows,"Schongauer, Martin (1435/50-1491)",1470,c. 1470,"Prints of the Man of Sorrow were widely widespread in Northern Europe after the mid-15th century. The image portrays Christ naked above the waist, wearing the crown of thorns, and displaying the wounds of the Passion marking his hands and side. The Virgin Mary and Saint John the Evangelist flank Christ and mourn his death. Images like these functioned as devotional tools meant to help the faithful to meditate on the Lord's suffering. By showing Christ's hand over his chest and the Virgin's hand on his side, he focused the viewer's attention on Christ's wounds. Similarly, Saint John's compassionate gaze provides a model of empathy for the beholder.",,"New York, USA",Metropolitan Museum of Art,image/jpeg,engraving; 21.2 × 16.2 cm,"""Man of Sorrows"" by Metropolitan Museum, Harris Brisbane Dick Fund, 1951, (https://www.metmuseum.org/art/collection/search/367001), Public Domain.",40.77965593,-73.96264319
image22,image22.jpg,Christ the Savior,"Master E.S. (German, active ca. 1450–67)",1460,C. 1460,"This drawing of Christ by Master E.S. is a good example of his skill with a Burin – an engraver’s chisel. Master E.S. was a goldsmith before he was an engraver and many believe it was his jewelry-making expertise that led to some of the innovations he made in printmaking. Being able to chisel a little deeper into the wood, Master E.S. was able to make more prints from each engraving. This engraving of Christ as Savior also show his skill in using short lines and cross-hatching to create dimension, shading and texture. Wearing jewelry robes and looking like he is coming out of a window or alcove of some sort, Christ appears to be looking right at the observer. Description source: http://www.thefamousartists.com/master-e-s/christ-as-saviour",,"New York, USA",Metropolitan Museum of Art,image/jpeg,engraving; 15.7cm X 11.6cm,"""Christ the Savior"" by the Metropolitan Museum, Gift of Felix M. Warburg and his family, 1941 (https://www.metmuseum.org/art/collection/search/366489), Public Domain",40.77965593,-73.96264319
image23,image23.jpg,John Devouring the Book,"Dürer, Albrecht (1471-1528)",1497,1497-1498,"The Book of the Revelation of St John, commonly known as the Apocalypse, was a popular subject for illustration throughout the Middle Ages, series of images appearing in illuminated manuscripts, frescoes and, famously, a vast tapestry at Angers. The text, with its predictions of violent turmoil, became increasingly referred to in the approach to the year 1500, when it was widely believed that the world would end. In Dürer’s native city, the Nuremberg Chronicle of 1493 was published with blank leaves for readers to record the final events of an age that was believed to be coming to a dramatic close. Dürer’s vivid, and at times terrifying, woodcuts captured the fears of the age and the imagination of the market. The large number of surviving examples suggests a publication that was extremely popular.",,"New York, USA",Metropolitan Museum of Art,image/jpeg,woodcut; 39.6 x 28.7 cm,"""John Devouring the Book"" by the Royal Collection Trust, (https://www.rct.uk/collection/800141/the-apocalypse-st-john-devouring-the-book), Public Domain",40.77965593,-73.96264319
image24,image24.jpg,Four horseman of the Apocalypse,"Dürer, Albrecht (1471-1528)",1497,1497-1498,"The third and most famous woodcut from Dürer's series of illustrations for The Apocalypse, the Four Horsemen presents a dramatically distilled version of the passage from the Book of Revelation (6:1–8): ""And I saw, and behold, a white horse, and its rider had a bow; and a crown was given to him, and he went out conquering and to conquer. When he opened the second seal, I heard the second living creature say, 'Come!' And out came another horse, bright red; its rider was permitted to take peace from the earth, so that men should slay one another; and he was given a great sword. When he opened the third seal, I heard the third living creature say, 'Come!' And I saw, and behold, a black horse, and its rider had a balance in his hand; ... When he opened the fourth seal, I heard the voice of the fourth living creature say, 'Come!' And I saw, and behold, a pale horse, and its rider's name was Death, and Hades followed him; and they were given great power over a fourth of the earth; to kill with sword and with famine and with pestilence and by wild beasts of the earth."" Transforming what was a relatively staid and unthreatening image in earlier illustrated Bibles, Dürer injects motion and danger into this climactic moment through his subtle manipulation of the woodcut. The parallel lines across the image establish a basic middle tone against which the artist silhouettes and overlaps the powerful forms of the four horses and riders—from left to right, Death, Famine, War, and Plague (or Pestilence). Their volume and strong diagonal motion enhance the impact of the image, offering an eloquent demonstration of the masterful visual effects Dürer was able to create in this medium.",,"New York, USA",Metropolitan Museum of Art,image/jpeg,woodcut; 15 1/4 x 11 7/16 in. (38.8 x 29.1cm),"""Four horseman of the Apocalypse"" by the Metropolitan Museum, Gift of Mrs. Felix M.Warburg, 1940 (https://www.metmuseum.org/art/collection/search/336215), Public Domain",40.77965593,-73.96264319
